{
  "artifact_digest": "3560d8fc4dde5305a11311272e97852ca54d2a80d89479cc8214ee1c16d76dd7",
  "candidate": "baseline",
  "canonical_digest": "32a866ae0148bca1d96a185b9f02a99532db772eebd0590d7c3dbb7e972f7815",
  "phases": [
    {
      "duration_ms": 634,
      "exit_code": 0,
      "name": "build",
      "output": "",
      "points": 10.0,
      "status": "passed"
    },
    {
      "duration_ms": 192,
      "exit_code": 1,
      "name": "public_tests",
      "output": "stdout:\nTAP version 13\n# (node:16078) ExperimentalWarning: Type Stripping is an experimental feature and might change at any time\n# (Use `node --trace-warnings ...` to show where the warning was created)\n# Subtest: delivers a normal batch in order\nok 1 - delivers a normal batch in order\n  ---\n  duration_ms: 0.583375\n  type: 'test'\n  ...\n# Subtest: shares concurrent flush completion\nok 2 - shares concurrent flush completion\n  ---\n  duration_ms: 0.078792\n  type: 'test'\n  ...\n# Subtest: empty flush is harmless\nnot ok 3 - empty flush is harmless\n  ---\n  duration_ms: 0.342917\n  type: 'test'\n  location: '/private/var/folders/vw/nb62dcpx661fyvd3p005p5jw0000gn/T/repogauntlet-d9f1tovy/workspace/.repogauntlet_grader/public.test.mjs:16:1'\n  failureType: 'testCodeFailure'\n  error: |-\n    Expected values to be strictly equal:\n    \n    1 !== 0\n    \n  code: 'ERR_ASSERTION'\n  name: 'AssertionError'\n  expected: 0\n  actual: 1\n  operator: 'strictEqual'\n  stack: |-\n    TestContext.<anonymous> (file:///private/var/folders/vw/nb62dcpx661fyvd3p005p5jw0000gn/T/repogauntlet-d9f1tovy/workspace/.repogauntlet_grader/public.test.mjs:17:96)\n    async Test.run (node:internal/test_runner/test:1054:7)\n    async Test.processPendingSubtests (node:internal/test_runner/test:744:7)\n  ...\n1..3\n# tests 3\n# suites 0\n# pass 2\n# fail 1\n# cancelled 0\n# skipped 0\n# todo 0\n# duration_ms 79.362167",
      "points": 0.0,
      "status": "failed"
    },
    {
      "duration_ms": 181,
      "exit_code": 1,
      "name": "hidden_tests",
      "output": "stdout:\nTAP version 13\n# (node:16106) ExperimentalWarning: Type Stripping is an experimental feature and might change at any time\n# (Use `node --trace-warnings ...` to show where the warning was created)\n# Subtest: drains events accepted during an active flush\nnot ok 1 - drains events accepted during an active flush\n  ---\n  duration_ms: 0.996125\n  type: 'test'\n  location: '/private/var/folders/vw/nb62dcpx661fyvd3p005p5jw0000gn/T/repogauntlet-inv0etby/workspace/.repogauntlet_grader/hidden.test.mjs:5:1'\n  failureType: 'testCodeFailure'\n  error: |-\n    Expected values to be strictly deep-equal:\n    + actual - expected\n    \n      [\n        [\n          'first'\n        ],\n    -   [\n    -     'reentrant'\n    -   ]\n      ]\n    \n  code: 'ERR_ASSERTION'\n  name: 'AssertionError'\n  expected:\n    0:\n      0: 'first'\n    1:\n      0: 'reentrant'\n  actual:\n    0:\n      0: 'first'\n  operator: 'deepStrictEqual'\n  stack: |-\n    TestContext.<anonymous> (file:///private/var/folders/vw/nb62dcpx661fyvd3p005p5jw0000gn/T/repogauntlet-inv0etby/workspace/.repogauntlet_grader/hidden.test.mjs:9:10)\n    async Test.run (node:internal/test_runner/test:1054:7)\n    async startSubtestAfterBootstrap (node:internal/test_runner/harness:296:3)\n  ...\n# Subtest: restores a failed batch before newer events\nok 2 - restores a failed batch before newer events\n  ---\n  duration_ms: 0.230916\n  type: 'test'\n  ...\n1..2\n# tests 2\n# suites 0\n# pass 1\n# fail 1\n# cancelled 0\n# skipped 0\n# todo 0\n# duration_ms 75.932042",
      "points": 0.0,
      "status": "failed"
    },
    {
      "duration_ms": 0,
      "exit_code": 0,
      "name": "quality",
      "output": "quality command skipped until behavior passes",
      "points": 0.0,
      "status": "skipped"
    }
  ],
  "schema_version": "1.0",
  "score": 10.0,
  "seed": 42,
  "task_id": "TS-BATCHER-001",
  "toolchain": {
    "host": "macOS-26.6.2-arm64-arm-64bit",
    "python": "3.9.6"
  },
  "verdict": "TEST_FAILED"
}
