{
  "artifact_digest": "a2a3a14a2af843e42fc140c177dfb8f101961e91bf2eba59aa3c5bc29a8e3104",
  "candidate": "mutant",
  "canonical_digest": "6022fec90dd645822624a1e81e0dbc17b5298bfb4fcf6b96e70861e6c6383b72",
  "phases": [
    {
      "duration_ms": 318,
      "exit_code": 0,
      "name": "build",
      "output": "",
      "points": 10.0,
      "status": "passed"
    },
    {
      "duration_ms": 1111,
      "exit_code": 0,
      "name": "public_tests",
      "output": "stdout:\npublic top-k contract passed\nREPOGAUNTLET_PHASE_COMPLETE:public_tests",
      "points": 25.0,
      "status": "passed"
    },
    {
      "duration_ms": 1040,
      "exit_code": 1,
      "name": "hidden_tests",
      "output": "stderr:\nsemantic top-k mismatch\nTraceback (most recent call last):\n  File \"/private/var/folders/vw/nb62dcpx661fyvd3p005p5jw0000gn/T/repogauntlet-380q3hxt/workspace/.repogauntlet_grader/run_cpp.py\", line 9, in <module>\n    subprocess.run([str(binary.resolve())],check=True)\n  File \"/Library/Developer/CommandLineTools/Library/Frameworks/Python3.framework/Versions/3.9/lib/python3.9/subprocess.py\", line 528, in run\n    raise CalledProcessError(retcode, process.args,\nsubprocess.CalledProcessError: Command '['/private/var/folders/vw/nb62dcpx661fyvd3p005p5jw0000gn/T/repogauntlet-380q3hxt/workspace/grader-hidden']' returned non-zero exit status 1.",
      "points": 0.0,
      "status": "failed"
    },
    {
      "duration_ms": 0,
      "exit_code": 0,
      "name": "quality",
      "output": "quality command skipped until behavior passes",
      "points": 0.0,
      "status": "skipped"
    }
  ],
  "schema_version": "1.0",
  "score": 35.0,
  "seed": 42,
  "task_id": "CPP-TOPK-001",
  "toolchain": {
    "host": "macOS-26.6.2-arm64-arm-64bit",
    "python": "3.9.6"
  },
  "verdict": "TEST_FAILED"
}
