{
  "artifact_digest": "58c59b14da9beba8a490173afa88a9ca9f4a297eca7a3081e10a3d7eb3f84e06",
  "candidate": "golden",
  "canonical_digest": "ec4da2de4524d71fa51c6e54da84f3af2f26f407efd2cecbdb2a2b8cf1b8eb3c",
  "phases": [
    {
      "duration_ms": 108,
      "exit_code": 0,
      "name": "build",
      "output": "",
      "points": 10.0,
      "status": "passed"
    },
    {
      "duration_ms": 206,
      "exit_code": 0,
      "name": "public_tests",
      "output": "stdout:\nREPOGAUNTLET_PHASE_COMPLETE:public_tests\nstderr:\n...\n----------------------------------------------------------------------\nRan 3 tests in 0.000s\n\nOK",
      "points": 25.0,
      "status": "passed"
    },
    {
      "duration_ms": 222,
      "exit_code": 0,
      "name": "hidden_tests",
      "output": "stdout:\nREPOGAUNTLET_PHASE_COMPLETE:hidden_tests\nstderr:\n...\n----------------------------------------------------------------------\nRan 3 tests in 0.014s\n\nOK",
      "points": 65.0,
      "status": "passed"
    },
    {
      "duration_ms": 83,
      "exit_code": 0,
      "name": "quality",
      "output": "",
      "points": 0.0,
      "status": "passed"
    }
  ],
  "schema_version": "1.0",
  "score": 100.0,
  "seed": 42,
  "task_id": "PY-INTERVAL-001",
  "toolchain": {
    "host": "macOS-26.6.2-arm64-arm-64bit",
    "python": "3.9.6"
  },
  "verdict": "RESOLVED"
}
