{
  "artifact_digest": "57c1cd873c0c45fafd2e61e68b563bbed25f41964ea8a88585997d42391866f4",
  "candidate": "mutant",
  "canonical_digest": "f740f9dcb053702daad5124af3a50013f66e6d4679ce49e669c42035c872e0f2",
  "phases": [
    {
      "duration_ms": 404,
      "exit_code": 0,
      "name": "build",
      "output": "",
      "points": 10.0,
      "status": "passed"
    },
    {
      "duration_ms": 568,
      "exit_code": 1,
      "name": "public_tests",
      "output": "stderr:\nException in thread \"main\" java.lang.AssertionError: lost credits: 32526 != 160000\n\tat PublicTest.assertConcurrentCredits(PublicTest.java:27)\n\tat PublicTest.main(PublicTest.java:8)",
      "points": 0.0,
      "status": "failed"
    },
    {
      "duration_ms": 925,
      "exit_code": 1,
      "name": "hidden_tests",
      "output": "stderr:\nException in thread \"main\" java.lang.AssertionError: lost credits: 65183 != 800000\n\tat PublicTest.assertConcurrentCredits(PublicTest.java:27)\n\tat HiddenTest.main(HiddenTest.java:7)",
      "points": 0.0,
      "status": "failed"
    },
    {
      "duration_ms": 0,
      "exit_code": 0,
      "name": "quality",
      "output": "quality command skipped until behavior passes",
      "points": 0.0,
      "status": "skipped"
    }
  ],
  "schema_version": "1.0",
  "score": 10.0,
  "seed": 42,
  "task_id": "JAVA-LEDGER-001",
  "toolchain": {
    "host": "Linux-6.17.0-1022-azure-x86_64-with-glibc2.39",
    "python": "3.12.14"
  },
  "verdict": "TEST_FAILED"
}
