{
  "artifact_digest": "aebaa18f47adb0ee35e4b0730b508914f26a6133bc269c7c535dd3df06024752",
  "candidate": "mutant",
  "canonical_digest": "e7301dbb32ff7d9530c1e9f0ec162012ac95bad3c59e019eae8ae35e8fc342e6",
  "phases": [
    {
      "duration_ms": 93,
      "exit_code": 0,
      "name": "build",
      "output": "",
      "points": 10.0,
      "status": "passed"
    },
    {
      "duration_ms": 224,
      "exit_code": 0,
      "name": "public_tests",
      "output": "stdout:\nREPOGAUNTLET_PHASE_COMPLETE:public_tests\nstderr:\n...\n----------------------------------------------------------------------\nRan 3 tests in 0.000s\n\nOK",
      "points": 25.0,
      "status": "passed"
    },
    {
      "duration_ms": 221,
      "exit_code": 1,
      "name": "hidden_tests",
      "output": "stderr:\n.F.\n======================================================================\nFAIL: test_reversed_rejected (__main__.HiddenContract)\n----------------------------------------------------------------------\nTraceback (most recent call last):\n  File \"/private/var/folders/vw/nb62dcpx661fyvd3p005p5jw0000gn/T/repogauntlet-xrojt7b7/workspace/.repogauntlet_grader/hidden_test.py\", line 31, in test_reversed_rejected\n    reconcile([(5, 3)])\nAssertionError: ValueError not raised\n\n----------------------------------------------------------------------\nRan 3 tests in 0.015s\n\nFAILED (failures=1)",
      "points": 0.0,
      "status": "failed"
    },
    {
      "duration_ms": 0,
      "exit_code": 0,
      "name": "quality",
      "output": "quality command skipped until behavior passes",
      "points": 0.0,
      "status": "skipped"
    }
  ],
  "schema_version": "1.0",
  "score": 35.0,
  "seed": 42,
  "task_id": "PY-INTERVAL-001",
  "toolchain": {
    "host": "macOS-26.6.2-arm64-arm-64bit",
    "python": "3.9.6"
  },
  "verdict": "TEST_FAILED"
}
