{
  "artifact_digest": "3ecfc4b626a46c7d59cf980a40b8fe4e01984b054770ff97ac90961ce99d655b",
  "candidate": "golden",
  "canonical_digest": "4d202fddfbbe7c447a6c67302bb2b7762802d2a11ae8681451f3f5e9763b5dc7",
  "phases": [
    {
      "duration_ms": 324,
      "exit_code": 0,
      "name": "build",
      "output": "",
      "points": 10.0,
      "status": "passed"
    },
    {
      "duration_ms": 1169,
      "exit_code": 0,
      "name": "public_tests",
      "output": "stdout:\npublic top-k contract passed\nREPOGAUNTLET_PHASE_COMPLETE:public_tests",
      "points": 25.0,
      "status": "passed"
    },
    {
      "duration_ms": 972,
      "exit_code": 0,
      "name": "hidden_tests",
      "output": "stdout:\nhidden top-k contract passed with 100777 grader-observed comparisons\nREPOGAUNTLET_PHASE_COMPLETE:hidden_tests",
      "points": 65.0,
      "status": "passed"
    },
    {
      "duration_ms": 241,
      "exit_code": 0,
      "name": "quality",
      "output": "",
      "points": 0.0,
      "status": "passed"
    }
  ],
  "schema_version": "1.0",
  "score": 100.0,
  "seed": 42,
  "task_id": "CPP-TOPK-001",
  "toolchain": {
    "host": "macOS-26.6.2-arm64-arm-64bit",
    "python": "3.9.6"
  },
  "verdict": "RESOLVED"
}
